{
  "schema": "run_manifest_v1",
  "run_id": "zero_touch_20260628T114830Z",
  "generated_utc": "2026-06-28T11:48:30.437791+00:00",
  "mode": "plan-only",
  "status": "planned",
  "reports_dir": "<REPO_ROOT>/reports",
  "lock_file": "<REPO_ROOT>/reports/final_orchestrator.lock.json",
  "resume_policy": "auto",
  "train_command": "<REPO_ROOT>/.titan-venv/bin/python -m accelerate.commands.launch --num_processes 1 --num_machines 1 --mixed_precision bf16 --main_process_port 29501 train/train.py",
  "post_mode": "full",
  "training_lane": null,
  "train_readiness_status": null,
  "decision_reason_code": null,
  "steps": [
    {
      "name": "contract_outputs",
      "status": "completed",
      "return_code": 0,
      "note": "Run contract, artifact list, exit code standard, and run manifest schema refreshed."
    },
    {
      "name": "post_train_plan_refresh",
      "status": "completed",
      "return_code": 0,
      "note": "{\"status\": \"planned\", \"mode\": \"plan-only\", \"checkpoint\": \"<REPO_ROOT>/checkpoints/offline_4060_demo/MertFormer_Titan_Offline_4060_Demo_latest.pt\"}\n",
      "cmd": "<REPO_ROOT>/.titan-venv/bin/python scripts/post_train_autorun.py --plan-only --allow-missing-checkpoint --reports-dir <REPO_ROOT>/reports --report-out <REPO_ROOT>/reports/post_train_autorun_status.json"
    },
    {
      "name": "start_gate",
      "status": "planned",
      "return_code": 0,
      "note": "Refresh verify/readiness gate and exact blocker report."
    },
    {
      "name": "training",
      "status": "planned",
      "return_code": 0,
      "note": "Launch accelerate training path with resume policy applied."
    },
    {
      "name": "post_train",
      "status": "planned",
      "return_code": 0,
      "note": "Run post-train state machine in full mode."
    }
  ]
}
